{"dtdPath":"conformance/HermitCrabInput.dtd","dtdSha256":"c9b9e15d5fb1a6a00df58c351dfbdbea3b2101c90e3d08d02c64c37ca3dd3b5a","fixtures":[{"caseCount":2,"category":"edge-case","displayLanguage":"AlphaVariableNameCollision","expectedCrash":false,"fixtureId":"edge-cases/alpha-variable-name-collision","grammarPath":"conformance/edge-cases/alpha-variable-name-collision/grammar.xml","grammarSha256":"fd80ccd8826850e09afd04014e0cbed94fcf3cbaf4d47bb2b13922a4aba909b4","wordsPath":"conformance/edge-cases/alpha-variable-name-collision/words.yaml","wordsSha256":"72243f1e7fc12b28451ba80e2231f01d377378a04c30eec24904d6ef3013d2b2"},{"caseCount":5,"category":"edge-case","displayLanguage":"BistratalOverlappingSegmentRepresentation","expectedCrash":false,"fixtureId":"edge-cases/bistratal-overlapping-segment-representation","grammarPath":"conformance/edge-cases/bistratal-overlapping-segment-representation/grammar.xml","grammarSha256":"b593e480ed7baa4851a1a784511377713fffc7a5036161a86c6f6df716a0d843","wordsPath":"conformance/edge-cases/bistratal-overlapping-segment-representation/words.yaml","wordsSha256":"2336f47ca091a8091c56ca76287a42a4230ad128d0961d1469ff266c85da3ed4"},{"caseCount":6,"category":"edge-case","displayLanguage":"BoundaryFirstInNarrowingLhs","expectedCrash":false,"fixtureId":"edge-cases/boundary-first-in-narrowing-lhs","grammarPath":"conformance/edge-cases/boundary-first-in-narrowing-lhs/grammar.xml","grammarSha256":"57b4ad2366126be7d936cde11bc3918589944a723637ba478e2779c72eab62d0","wordsPath":"conformance/edge-cases/boundary-first-in-narrowing-lhs/words.yaml","wordsSha256":"404b18b61a54cc79243a0fd8f08d870ca2218867e8a2b5a2c6ea090613799e2d"},{"caseCount":6,"category":"edge-case","displayLanguage":"BoundaryFirstInNarrowingLhsStrrep","expectedCrash":false,"fixtureId":"edge-cases/boundary-first-in-narrowing-lhs-strrep","grammarPath":"conformance/edge-cases/boundary-first-in-narrowing-lhs-strrep/grammar.xml","grammarSha256":"66030b47992ee1e9dc8c2a10baf2229bc786af5e5059c1b8c3154ec1a9bd967d","wordsPath":"conformance/edge-cases/boundary-first-in-narrowing-lhs-strrep/words.yaml","wordsSha256":"49ccc33b419f11971456b06f1f29d9680b14362f1029169da90a5328f6dcc0ca"},{"caseCount":8,"category":"edge-case","displayLanguage":"BoundaryLeftoverInNarrowingLhsStrrep","expectedCrash":false,"fixtureId":"edge-cases/boundary-leftover-in-narrowing-lhs-strrep","grammarPath":"conformance/edge-cases/boundary-leftover-in-narrowing-lhs-strrep/grammar.xml","grammarSha256":"6961a8a41c8a82790bf0a0f7101970a116b6e76e13421ff0e69d26aaba2cc143","wordsPath":"conformance/edge-cases/boundary-leftover-in-narrowing-lhs-strrep/words.yaml","wordsSha256":"62e5c878245e9226572157a68b321b1f4498a890854216d3e5a47d59a961a03a"},{"caseCount":6,"category":"edge-case","displayLanguage":"BoundaryMidInNarrowingLhsStrrep","expectedCrash":false,"fixtureId":"edge-cases/boundary-mid-in-narrowing-lhs-strrep","grammarPath":"conformance/edge-cases/boundary-mid-in-narrowing-lhs-strrep/grammar.xml","grammarSha256":"26034de7c0efcd0166c5e6ec77388142ca38b2c637f5168057bba50e3e4732aa","wordsPath":"conformance/edge-cases/boundary-mid-in-narrowing-lhs-strrep/words.yaml","wordsSha256":"feddbf19bc8f5d179626735c2801f5744aed19013749a73f21a8799160749fc5"},{"caseCount":6,"category":"edge-case","displayLanguage":"ChainedOutputFeatureOverrideLoss","expectedCrash":false,"fixtureId":"edge-cases/chained-output-feature-override-loss","grammarPath":"conformance/edge-cases/chained-output-feature-override-loss/grammar.xml","grammarSha256":"5e016c04f739bc8d19bddd5cb6b6e492836943b2df837e361154ba97e1017e71","wordsPath":"conformance/edge-cases/chained-output-feature-override-loss/words.yaml","wordsSha256":"076aaa4a15201be71e64150a1bd4d9fcdf996bb0bee5f5dc1886fb63209ffdc8"},{"caseCount":11,"category":"edge-case","displayLanguage":"CliticRuleDesignation","expectedCrash":false,"fixtureId":"edge-cases/clitic-rule-designation","grammarPath":"conformance/edge-cases/clitic-rule-designation/grammar.xml","grammarSha256":"3f1521ace7ff3fe5f91f5ae9aee8806b547681ff7184ab8c7d4d00a4687f4ef6","wordsPath":"conformance/edge-cases/clitic-rule-designation/words.yaml","wordsSha256":"9ad16b88b8bfe2c68eda23c4abbb30ccda6a1fc4d638995d357e2936727352fe"},{"caseCount":10,"category":"edge-case","displayLanguage":"CompoundingBreadth","expectedCrash":false,"fixtureId":"edge-cases/compounding-breadth","grammarPath":"conformance/edge-cases/compounding-breadth/grammar.xml","grammarSha256":"dff3679ead5a9c1c1cb67b3b6c72644cb853b730178d1d86aa714b011ae44e7c","wordsPath":"conformance/edge-cases/compounding-breadth/words.yaml","wordsSha256":"5d2c6724970af898b1a481db109f31854ea247842bc2a1798d008fcbc8e82e44"},{"caseCount":7,"category":"edge-case","displayLanguage":"CrossTableRootRespelling","expectedCrash":false,"fixtureId":"edge-cases/cross-table-root-respelling","grammarPath":"conformance/edge-cases/cross-table-root-respelling/grammar.xml","grammarSha256":"854bb9e0697aa3024373823337ba0fe3b9f47ad7fbfc29028b0b2816a6ec63f9","wordsPath":"conformance/edge-cases/cross-table-root-respelling/words.yaml","wordsSha256":"2aef6d589ecda5b6da7843f18828614429b23e36a43978568edf83e8c47e39ce"},{"caseCount":3,"category":"edge-case","displayLanguage":"PathologicalDeepOptionalAffixNesting","expectedCrash":false,"fixtureId":"edge-cases/deep-optional-affix-nesting","grammarPath":"conformance/edge-cases/deep-optional-affix-nesting/grammar.xml","grammarSha256":"ca08b180c5eccbee358c0d3609df3d0b43130b13c0d8be5900235f4f69c63112","wordsPath":"conformance/edge-cases/deep-optional-affix-nesting/words.yaml","wordsSha256":"92330f36ae3a9cafefa93f7cc36ff1e102f55fe66412c9e6e52d2e4d49f18b8f"},{"caseCount":2,"category":"edge-case","displayLanguage":"DefaultSymbolAfterMerge","expectedCrash":false,"fixtureId":"edge-cases/default-symbol-after-merge","grammarPath":"conformance/edge-cases/default-symbol-after-merge/grammar.xml","grammarSha256":"5c55cdfa21b366e0381b55737f9e81f3a6ace46b929f62fea637ad145ed5fb70","wordsPath":"conformance/edge-cases/default-symbol-after-merge/words.yaml","wordsSha256":"9dd963ba073eaf93f3ca220c0c7c311fcb0936d4df78d3f80612671e3e729d32"},{"caseCount":4,"category":"edge-case","displayLanguage":"DeletionReinsertedFeatureUnapply","expectedCrash":false,"fixtureId":"edge-cases/deletion-reinserted-feature-unapply","grammarPath":"conformance/edge-cases/deletion-reinserted-feature-unapply/grammar.xml","grammarSha256":"ae02f30fe7ccc862a91e4b181b9670ad8e2e1bd7ff123c812ff8152c58036ffd","wordsPath":"conformance/edge-cases/deletion-reinserted-feature-unapply/words.yaml","wordsSha256":"7038d4726774a94f169350eda4a85e6b5de3d6bc6ad7e78129aa04154cb6a00d"},{"caseCount":13,"category":"edge-case","displayLanguage":"LatinDiacriticProbe","expectedCrash":false,"fixtureId":"edge-cases/diacritic-segments","grammarPath":"conformance/edge-cases/diacritic-segments/grammar.xml","grammarSha256":"bf41b716eb7ea5f6e12c09432bead513eb279dc32a1dfa6a369f56a2568795c1","wordsPath":"conformance/edge-cases/diacritic-segments/words.yaml","wordsSha256":"2ee90483260b4ee522c3279c9e1cf6c222bfcad5462fc2c09ac3ca4c0c2f627b"},{"caseCount":5,"category":"edge-case","displayLanguage":"DiscontinuousMorphEnvironment","expectedCrash":false,"fixtureId":"edge-cases/discontinuous-morph-environment","grammarPath":"conformance/edge-cases/discontinuous-morph-environment/grammar.xml","grammarSha256":"8373c9e020f73280dc15bd989b6a39c06213378718b87546eb663fe55df6cec0","wordsPath":"conformance/edge-cases/discontinuous-morph-environment/words.yaml","wordsSha256":"1e28c7e6625e6166f0fd8a3d6c26e3abb4c90d0b5d1db313f38b63ac3fc2189c"},{"caseCount":12,"category":"edge-case","displayLanguage":"DisjunctiveRecheckProbe","expectedCrash":false,"fixtureId":"edge-cases/disjunctive-recheck","grammarPath":"conformance/edge-cases/disjunctive-recheck/grammar.xml","grammarSha256":"2aa29599b8ec8fcc5b9eaf557985c1810b89eef078b8a5d3ca6e2c332d65db09","wordsPath":"conformance/edge-cases/disjunctive-recheck/words.yaml","wordsSha256":"eccc031b78b89795006e66dd62aee592aaf92da15400a32420c2774e43eec16b"},{"caseCount":2,"category":"edge-case","displayLanguage":"EpenthesisFedMerge","expectedCrash":false,"fixtureId":"edge-cases/epenthesis-fed-merge","grammarPath":"conformance/edge-cases/epenthesis-fed-merge/grammar.xml","grammarSha256":"830384ff16df86879bef6c783b7f28c1b96254d53cff7c089abbb9e279029a38","wordsPath":"conformance/edge-cases/epenthesis-fed-merge/words.yaml","wordsSha256":"2812eec2e46ab6af1d46affe7f837200cba66eb3249585756800ffda8c64fa97"},{"caseCount":4,"category":"edge-case","displayLanguage":"ExpansionOverlappingTargets","expectedCrash":false,"fixtureId":"edge-cases/expansion-overlapping-targets","grammarPath":"conformance/edge-cases/expansion-overlapping-targets/grammar.xml","grammarSha256":"f2a0b9e7023d601ec0902c149807cee655cee0f87b3bda32b6fea4dde76bbff2","wordsPath":"conformance/edge-cases/expansion-overlapping-targets/words.yaml","wordsSha256":"7ce8c70087004e0159908c2f5b243e8784e60c70dc776786ff5c371fde7ea9a3"},{"caseCount":15,"category":"edge-case","displayLanguage":"FeatureGatingBreadth","expectedCrash":false,"fixtureId":"edge-cases/feature-gating-breadth","grammarPath":"conformance/edge-cases/feature-gating-breadth/grammar.xml","grammarSha256":"ad1d71f27ebedc60e9738277c06bc4c0fa040255e24b9bd0f74bdf573ec2ff77","wordsPath":"conformance/edge-cases/feature-gating-breadth/words.yaml","wordsSha256":"67ba2ce089220c8755ea885d0dc933ccdbe747f526689d50699dc76451c3f562"},{"caseCount":2,"category":"edge-case","displayLanguage":"FeatureRuleBeforeMerge","expectedCrash":false,"fixtureId":"edge-cases/feature-rule-before-merge","grammarPath":"conformance/edge-cases/feature-rule-before-merge/grammar.xml","grammarSha256":"3635ada035246e663acd17da90eaf6193a378b35e2210efd358b5a2da46583b9","wordsPath":"conformance/edge-cases/feature-rule-before-merge/words.yaml","wordsSha256":"86091237d6580adf29eec77c73076041713d2e569c0b4f95caa1bdce9a97e22c"},{"caseCount":18,"category":"edge-case","displayLanguage":"FeatureSystemBreadth","expectedCrash":false,"fixtureId":"edge-cases/feature